[
  { "id": "mbr_acad_kira",    "firstName": "Kira",    "lastName": "Mendez",      "email": "kira.mendez@example.com",      "phone": "555-0411", "tier": "Social",    "handicap": 12.4, "joinDate": "2024-09-01", "active": true,  "balance": 0, "status": "Active",   "oldestUnpaidChargeAt": null, "suspendedAt": null, "notes": "Junior development track. Age 14. Targeting AJGA in 2027. Tuesday + Saturday sessions with Anand." },
  { "id": "mbr_acad_aiden",   "firstName": "Aiden",   "lastName": "Mendez",      "email": "aiden.mendez@example.com",     "phone": "555-0412", "tier": "Full",      "handicap":  8.4, "joinDate": "2024-09-01", "active": true,  "balance": 0, "status": "Active",   "oldestUnpaidChargeAt": null, "suspendedAt": null, "notes": "Kira's dad. Wedge Lab member. Plays Saturday rounds with daughter — keep them grouped." },
  { "id": "mbr_acad_morgan",  "firstName": "Morgan",  "lastName": "Hayes",       "email": "morgan.hayes@example.com",     "phone": "555-0413", "tier": "Weekday",   "handicap": 26.3, "joinDate": "2025-03-12", "active": true,  "balance": 0, "status": "Active",   "oldestUnpaidChargeAt": null, "suspendedAt": null, "notes": "Improvement program — weekdays only. Goal: under 22 by Labor Day. Loves Crucible #2." },
  { "id": "mbr_acad_sasha",   "firstName": "Sasha",   "lastName": "Volkov",      "email": "sasha.volkov@example.com",     "phone": "555-0414", "tier": "Full",      "handicap":  4.2, "joinDate": "2023-04-22", "active": true,  "balance": 0, "status": "Active",   "oldestUnpaidChargeAt": null, "suspendedAt": null, "notes": "Competitive mid-am. Pre-event prep block: 14:00-17:00 the Friday before any State Am." },
  { "id": "mbr_acad_brian",   "firstName": "Brian",   "lastName": "Patel",       "email": "brian.patel@example.com",      "phone": "555-0415", "tier": "Full",      "handicap": 18.0, "joinDate": "2025-01-08", "active": true,  "balance": 0, "status": "Active",   "oldestUnpaidChargeAt": null, "suspendedAt": null, "notes": "Comeback player — 12 years off. Cleared by Fukuda for full bag work. Right-shoulder mobility flag." },
  { "id": "mbr_acad_lena",    "firstName": "Lena",    "lastName": "Caruso",      "email": "lena.caruso@example.com",      "phone": "555-0416", "tier": "Social",    "handicap": 36.0, "joinDate": "2026-05-12", "active": true,  "balance": 0, "status": "Active",   "oldestUnpaidChargeAt": null, "suspendedAt": null, "notes": "Brand-new golfer; intake completed 2026-05-12. Social membership = lessons + Forge access only." },
  { "id": "mbr_acad_devin",   "firstName": "Devin",   "lastName": "Okafor",      "email": "devin.okafor@example.com",     "phone": "555-0417", "tier": "Social",    "handicap": 22.5, "joinDate": "2025-06-02", "active": true,  "balance": 0, "status": "Active",   "oldestUnpaidChargeAt": null, "suspendedAt": null, "notes": "Age 11. Junior dev program. Mom (Sade Okafor) handles billing — copy on all comms." },
  { "id": "mbr_acad_kim",     "firstName": "Kim",     "lastName": "Tran",        "email": "kim.tran@example.com",         "phone": "555-0418", "tier": "Weekday",   "handicap": 14.2, "joinDate": "2024-11-19", "active": true,  "balance": 0, "status": "Active",   "oldestUnpaidChargeAt": null, "suspendedAt": null, "notes": "Short-game focus. Almost always books Forge or Scoring Nine. Prefers walking." },
  { "id": "mbr_acad_max",     "firstName": "Max",     "lastName": "Halberg",     "email": "max.halberg@halbergco.example","phone": "555-0419", "tier": "Corporate", "handicap": 15.0, "joinDate": "2025-09-14", "active": true,  "balance": 0, "status": "Active",   "oldestUnpaidChargeAt": null, "suspendedAt": null, "notes": "Executive coaching client — Halberg & Co. corporate package. Bills monthly via Corporate AR." },
  { "id": "mbr_acad_juno",    "firstName": "Juno",    "lastName": "Castellanos", "email": "juno.castellanos@example.com", "phone": "555-0420", "tier": "Full",      "handicap": 11.8, "joinDate": "2022-07-30", "active": true,  "balance": 0, "status": "Active",   "oldestUnpaidChargeAt": null, "suspendedAt": null, "notes": "Senior member. Twilight regular. Walking only after knee replacement (2024). Prefers Forward tees." },
  { "id": "mbr_acad_riley",   "firstName": "Riley",   "lastName": "Ashford",     "email": "riley.ashford@example.com",    "phone": "555-0421", "tier": "Full",      "handicap":  1.8, "joinDate": "2024-08-05", "active": true,  "balance": 0, "status": "Active",   "oldestUnpaidChargeAt": null, "suspendedAt": null, "notes": "D1 prospect (committed Vanderbilt 2027). Calderón is primary coach. Confidential — do NOT post junior leaderboard with full name." },
  { "id": "mbr_acad_marisol", "firstName": "Marisol", "lastName": "Reyes",       "email": "marisol.reyes@example.com",    "phone": "555-0422", "tier": "Social",    "handicap": 19.5, "joinDate": "2023-10-11", "active": false, "balance": 0, "status": "Inactive", "oldestUnpaidChargeAt": null, "suspendedAt": null, "notes": "Former academy intern. Inactive — paused membership during grad school. Reach out before re-engaging." }
]
